{
  "schema": "dyn_zeta/1",
  "generated_by": "f16d927",
  "construction_gap": "This subshift: fully constructed — orbits are closed paths, the Euler product = determinant identity IS geometry. Deninger's arithmetic flow: not constructed — the same identity (explicit formula) holds, but the dynamical system is conjectural.",
  "orbit_truncation_N": 150,
  "models": [
    {"name": "golden_mean_const_roof", "abscissa": 0.48121182506, "roof": [1,1], "s": [0.60121182506,0.625413505732,0.649615186404,0.673816867076,0.698018547749,0.722220228421,0.746421909093,0.770623589765,0.794825270438,0.81902695111,0.843228631782,0.867430312455,0.891631993127,0.915833673799,0.940035354471,0.964237035144,0.988438715816,1.01264039649,1.03684207716,1.06104375783,1.0852454385,1.10944711918,1.13364879985,1.15785048052,1.18205216119,1.20625384187,1.23045552254,1.25465720321,1.27885888388,1.30306056456,1.32726224523,1.3514639259,1.37566560657,1.39986728724,1.42406896792,1.44827064859,1.47247232926,1.49667400993,1.52087569061,1.54507737128,1.56927905195,1.59348073262,1.61768241329,1.64188409397,1.66608577464,1.69028745531,1.71448913598,1.73869081666,1.76289249733,1.787094178,1.81129585867,1.83549753935,1.85969922002,1.88390090069,1.90810258136,1.93230426203,1.95650594271,1.98070762338,2.00490930405,2.02911098472,2.0533126654,2.07751434607,2.10171602674,2.12591770741,2.15011938808,2.17432106876,2.19852274943,2.2227244301,2.24692611077,2.27112779145,2.29532947212,2.31953115279,2.34373283346,2.36793451414,2.39213619481,2.41633787548,2.44053955615,2.46474123682,2.4889429175,2.51314459817,2.53734627884,2.56154795951,2.58574964019,2.60995132086,2.63415300153,2.6583546822,2.68255636287,2.70675804355,2.73095972422,2.75516140489,2.77936308556,2.80356476624,2.82776644691,2.85196812758,2.87616980825,2.90037148893,2.9245731696,2.94877485027,2.97297653094,2.99717821161,3.02137989229,3.04558157296,3.06978325363,3.0939849343,3.11818661498,3.14238829565,3.16658997632,3.19079165699,3.21499333766,3.23919501834,3.26339669901,3.28759837968,3.31180006035,3.33600174103,3.3602034217,3.38440510237,3.40860678304,3.43280846372,3.45701014439,3.48121182506], "determinant": [6.60554693412,5.59622433332,4.87777104207,4.34053389936,3.92382109178,3.59131905551,3.31996932533,3.09442633743,2.90408139413,2.74136587943,2.60073507891,2.478034062,2.37008792027,2.27442890982,2.18910994856,2.11257418095,2.04356188408,1.98104281099,1.92416621562,1.87222339316,1.82461922562,1.78085030435,1.74048792163,1.70316471233,1.66856406327,1.63641164362,1.60646857672,1.57852589384,1.55239999752,1.52792892651,1.50496926171,1.48339354829,1.46308813637,1.44395136294,1.42589201377,1.4088280162,1.3926853235,1.37739695861,1.36290219151,1.34914582884,1.33607759828,1.32365161325,1.31182590611,1.30056201957,1.28982464833,1.27958132364,1.26980213497,1.26045948394,1.25152786594,1.24298367618,1.23480503679,1.22697164252,1.21946462267,1.21226641728,1.20536066591,1.19873210762,1.1923664907,1.18625049115,1.18037163898,1.17471825139,1.16927937204,1.16404471602,1.15900461955,1.15414999425,1.14947228536,1.14496343348,1.14061583965,1.13642233323,1.13237614249,1.1284708676,1.12470045567,1.12105917794,1.11754160855,1.11414260511,1.11085729065,1.10768103695,1.10460944911,1.10163835125,1.09876377326,1.09598193844,1.09328925208,1.09068229082,1.0881577927,1.08571264796,1.08334389041,1.08104868941,1.07882434231,1.07666826752,1.07457799788,1.07255117454,1.0705855412,1.06867893874,1.06682930015,1.06503464575,1.06329307878,1.06160278121,1.05996200975,1.05836909219,1.05682242389,1.0553204645,1.05386173485,1.05244481403,1.05106833666,1.04973099023,1.0484315127,1.04716869013,1.04594135451,1.04474838165,1.04358868926,1.04246123502,1.04136501489,1.04029906137,1.03926244194,1.03825425756,1.03727364121,1.03631975659,1.03539179676,1.03448898297,1.03361056345,1.03275581234], "orbit": [6.60554692914,5.59622433323,4.87777104207,4.34053389936,3.92382109178,3.59131905551,3.31996932533,3.09442633743,2.90408139413,2.74136587943,2.60073507891,2.478034062,2.37008792027,2.27442890982,2.18910994856,2.11257418095,2.04356188408,1.98104281099,1.92416621562,1.87222339316,1.82461922562,1.78085030435,1.74048792163,1.70316471233,1.66856406327,1.63641164362,1.60646857672,1.57852589384,1.55239999752,1.52792892651,1.50496926171,1.48339354829,1.46308813637,1.44395136294,1.42589201377,1.4088280162,1.3926853235,1.37739695861,1.36290219151,1.34914582884,1.33607759828,1.32365161325,1.31182590611,1.30056201957,1.28982464833,1.27958132364,1.26980213497,1.26045948394,1.25152786594,1.24298367618,1.23480503679,1.22697164252,1.21946462267,1.21226641728,1.20536066591,1.19873210762,1.1923664907,1.18625049115,1.18037163898,1.17471825139,1.16927937204,1.16404471602,1.15900461955,1.15414999425,1.14947228536,1.14496343348,1.14061583965,1.13642233323,1.13237614249,1.1284708676,1.12470045567,1.12105917794,1.11754160855,1.11414260511,1.11085729065,1.10768103695,1.10460944911,1.10163835125,1.09876377326,1.09598193844,1.09328925208,1.09068229082,1.0881577927,1.08571264796,1.08334389041,1.08104868941,1.07882434231,1.07666826752,1.07457799788,1.07255117454,1.0705855412,1.06867893874,1.06682930015,1.06503464575,1.06329307878,1.06160278121,1.05996200975,1.05836909219,1.05682242389,1.0553204645,1.05386173485,1.05244481403,1.05106833666,1.04973099023,1.0484315127,1.04716869013,1.04594135451,1.04474838165,1.04358868926,1.04246123502,1.04136501489,1.04029906137,1.03926244194,1.03825425756,1.03727364121,1.03631975659,1.03539179676,1.03448898297,1.03361056345,1.03275581234], "closed_form": [6.60554693412,5.59622433332,4.87777104207,4.34053389936,3.92382109178,3.59131905551,3.31996932533,3.09442633743,2.90408139413,2.74136587943,2.60073507891,2.478034062,2.37008792027,2.27442890982,2.18910994856,2.11257418095,2.04356188408,1.98104281099,1.92416621562,1.87222339316,1.82461922562,1.78085030435,1.74048792163,1.70316471233,1.66856406327,1.63641164362,1.60646857672,1.57852589384,1.55239999752,1.52792892651,1.50496926171,1.48339354829,1.46308813637,1.44395136294,1.42589201377,1.4088280162,1.3926853235,1.37739695861,1.36290219151,1.34914582884,1.33607759828,1.32365161325,1.31182590611,1.30056201957,1.28982464833,1.27958132364,1.26980213497,1.26045948394,1.25152786594,1.24298367618,1.23480503679,1.22697164252,1.21946462267,1.21226641728,1.20536066591,1.19873210762,1.1923664907,1.18625049115,1.18037163898,1.17471825139,1.16927937204,1.16404471602,1.15900461955,1.15414999425,1.14947228536,1.14496343348,1.14061583965,1.13642233323,1.13237614249,1.1284708676,1.12470045567,1.12105917794,1.11754160855,1.11414260511,1.11085729065,1.10768103695,1.10460944911,1.10163835125,1.09876377326,1.09598193844,1.09328925208,1.09068229082,1.0881577927,1.08571264796,1.08334389041,1.08104868941,1.07882434231,1.07666826752,1.07457799788,1.07255117454,1.0705855412,1.06867893874,1.06682930015,1.06503464575,1.06329307878,1.06160278121,1.05996200975,1.05836909219,1.05682242389,1.0553204645,1.05386173485,1.05244481403,1.05106833666,1.04973099023,1.0484315127,1.04716869013,1.04594135451,1.04474838165,1.04358868926,1.04246123502,1.04136501489,1.04029906137,1.03926244194,1.03825425756,1.03727364121,1.03631975659,1.03539179676,1.03448898297,1.03361056345,1.03275581234], "max_orbit_det_diff": 4.98001018201e-09},